{
  "version": 4,
  "device": "BQ76905",
  "description": "TI BQ76905 2S-5S battery monitor decode map (direct commands + subcommands), per SLUUCI8 Chapter 11.",
  "i2c_address": 8,
  "i2c_address_hex": "0x08",
  "i2c_address_8bit": {
    "write": "0x10",
    "read": "0x11"
  },
  "byte_order_note": "Multi-byte registers are little-endian on the wire.",
  "rules": [
    {
      "address": 8,
      "transaction_type": "indexed_read",
      "register": 20,
      "register_width_bytes": 1,
      "unit": "mV",
      "function": "X",
      "byte_order": "le",
      "signed": true,
      "data_bytes": 2,
      "format": "dec",
      "name": "Cell 1 Voltage",
      "description": "16-bit voltage on cell 1.",
      "group": "Cell Measurements",
      "group_order": 1,
      "access": "R"
    },
    {
      "address": 8,
      "transaction_type": "indexed_read",
      "register": 22,
      "register_width_bytes": 1,
      "unit": "mV",
      "function": "X",
      "byte_order": "le",
      "signed": true,
      "data_bytes": 2,
      "format": "dec",
      "name": "Cell 2 Voltage",
      "description": "16-bit voltage on cell 2.",
      "group": "Cell Measurements",
      "group_order": 2,
      "access": "R"
    },
    {
      "address": 8,
      "transaction_type": "indexed_read",
      "register": 24,
      "register_width_bytes": 1,
      "unit": "mV",
      "function": "X",
      "byte_order": "le",
      "signed": true,
      "data_bytes": 2,
      "format": "dec",
      "name": "Cell 3 Voltage",
      "description": "16-bit voltage on cell 3.",
      "group": "Cell Measurements",
      "group_order": 3,
      "access": "R"
    },
    {
      "address": 8,
      "transaction_type": "indexed_read",
      "register": 26,
      "register_width_bytes": 1,
      "unit": "mV",
      "function": "X",
      "byte_order": "le",
      "signed": true,
      "data_bytes": 2,
      "format": "dec",
      "name": "Cell 4 Voltage",
      "description": "16-bit voltage on cell 4.",
      "group": "Cell Measurements",
      "group_order": 4,
      "access": "R"
    },
    {
      "address": 8,
      "transaction_type": "indexed_read",
      "register": 28,
      "register_width_bytes": 1,
      "unit": "mV",
      "function": "X",
      "byte_order": "le",
      "signed": true,
      "data_bytes": 2,
      "format": "dec",
      "name": "Cell 5 Voltage",
      "description": "16-bit voltage on cell 5.",
      "group": "Cell Measurements",
      "group_order": 5,
      "access": "R"
    },
    {
      "address": 8,
      "transaction_type": "indexed_read",
      "register": 38,
      "register_width_bytes": 1,
      "unit": "mV",
      "function": "X",
      "byte_order": "le",
      "signed": false,
      "data_bytes": 2,
      "format": "dec",
      "name": "Stack Voltage",
      "description": "16-bit voltage on top of stack.",
      "group": "Pack Measurements",
      "group_order": 1,
      "access": "R"
    },
    {
      "address": 8,
      "transaction_type": "indexed_read",
      "register": 34,
      "register_width_bytes": 1,
      "unit": "ADC codes",
      "function": "X",
      "byte_order": "le",
      "signed": false,
      "data_bytes": 2,
      "format": "dec",
      "name": "REG18 Voltage",
      "description": "Internal 1.8V regulator voltage measured using bandgap reference; diagnostic of VREF1 vs VREF2.",
      "group": "IC Measurements",
      "group_order": 1,
      "access": "R"
    },
    {
      "address": 8,
      "transaction_type": "indexed_read",
      "register": 36,
      "register_width_bytes": 1,
      "unit": "ADC codes",
      "function": "X",
      "byte_order": "le",
      "signed": true,
      "data_bytes": 2,
      "format": "dec",
      "name": "VSS Voltage",
      "description": "Measurement of VSS using ADC; diagnostic of ADC input mux.",
      "group": "IC Measurements",
      "group_order": 2,
      "access": "R"
    },
    {
      "address": 8,
      "transaction_type": "indexed_read",
      "register": 42,
      "register_width_bytes": 1,
      "unit": "ADC codes",
      "function": "X",
      "byte_order": "le",
      "signed": false,
      "data_bytes": 2,
      "format": "dec",
      "name": "TS Measurement",
      "description": "ADC measurement of the TS pin.",
      "group": "Pack Measurements",
      "group_order": 3,
      "access": "R"
    },
    {
      "address": 8,
      "transaction_type": "indexed_read",
      "register": 40,
      "register_width_bytes": 1,
      "unit": "degC",
      "function": "X*0.1",
      "byte_order": "le",
      "signed": true,
      "data_bytes": 2,
      "format": "dec",
      "name": "Int Temperature",
      "description": "Most recent measured internal die temperature.",
      "group": "IC Measurements",
      "group_order": 3,
      "access": "R"
    },
    {
      "address": 8,
      "transaction_type": "indexed_read",
      "register": 58,
      "register_width_bytes": 1,
      "unit": "userA",
      "function": "X",
      "byte_order": "le",
      "signed": true,
      "data_bytes": 2,
      "format": "dec",
      "name": "Current",
      "description": "16-bit CC2 current measurement.",
      "group": "Pack Measurements",
      "group_order": 2,
      "access": "R"
    },
    {
      "address": 8,
      "transaction_type": "indexed_read",
      "register": 60,
      "register_width_bytes": 1,
      "unit": "userA",
      "function": "X",
      "byte_order": "le",
      "signed": true,
      "data_bytes": 2,
      "format": "dec",
      "name": "CC1 Current",
      "description": "16-bit CC1 current measurement.",
      "group": "Current & Charge",
      "group_order": 1,
      "access": "R"
    },
    {
      "address": 8,
      "transaction_type": "indexed_read",
      "register": 54,
      "register_width_bytes": 1,
      "unit": "ADC codes",
      "function": "X",
      "byte_order": "le",
      "signed": true,
      "data_bytes": 4,
      "format": "dec",
      "name": "Raw Current",
      "description": "32-bit raw current measurement (24-bit sign-extended).",
      "group": "Current & Charge",
      "group_order": 2,
      "access": "R"
    },
    {
      "address": 8,
      "transaction_type": "indexed_read",
      "register": 2,
      "register_width_bytes": 1,
      "unit": "",
      "function": "",
      "byte_order": "le",
      "signed": false,
      "data_bytes": 1,
      "format": "bits",
      "name": "Safety Alert A",
      "description": "Provides individual alert signals when enabled safety alerts have triggered.",
      "bit_fields": [
        {
          "range": [
            7,
            7
          ],
          "mode": "enum",
          "names": [
            "COV=0",
            "COV=1"
          ],
          "description": "Cell Overvoltage Safety Alert"
        },
        {
          "range": [
            6,
            6
          ],
          "mode": "enum",
          "names": [
            "CUV=0",
            "CUV=1"
          ],
          "description": "Cell Undervoltage Safety Alert"
        },
        {
          "range": [
            5,
            5
          ],
          "mode": "enum",
          "names": [
            "SCD=0",
            "SCD=1"
          ],
          "description": "Short Circuit in Discharge Safety Alert"
        },
        {
          "range": [
            4,
            4
          ],
          "mode": "enum",
          "names": [
            "OCD1=0",
            "OCD1=1"
          ],
          "description": "Overcurrent in Discharge 1 Safety Alert"
        },
        {
          "range": [
            3,
            3
          ],
          "mode": "enum",
          "names": [
            "OCD2=0",
            "OCD2=1"
          ],
          "description": "Overcurrent in Discharge 2 Safety Alert"
        },
        {
          "range": [
            2,
            2
          ],
          "mode": "enum",
          "names": [
            "OCC=0",
            "OCC=1"
          ],
          "description": "Overcurrent in Charge Safety Alert"
        }
      ]
    },
    {
      "address": 8,
      "transaction_type": "indexed_read",
      "register": 3,
      "register_width_bytes": 1,
      "unit": "",
      "function": "",
      "byte_order": "le",
      "signed": false,
      "data_bytes": 1,
      "format": "bits",
      "name": "Safety Status A",
      "description": "Provides individual fault signals when enabled safety faults have triggered.",
      "bit_fields": [
        {
          "range": [
            7,
            7
          ],
          "mode": "enum",
          "names": [
            "COV=0",
            "COV=1"
          ],
          "description": "Cell Overvoltage Safety Fault"
        },
        {
          "range": [
            6,
            6
          ],
          "mode": "enum",
          "names": [
            "CUV=0",
            "CUV=1"
          ],
          "description": "Cell Undervoltage Safety Fault"
        },
        {
          "range": [
            5,
            5
          ],
          "mode": "enum",
          "names": [
            "SCD=0",
            "SCD=1"
          ],
          "description": "Short Circuit in Discharge Safety Fault"
        },
        {
          "range": [
            4,
            4
          ],
          "mode": "enum",
          "names": [
            "OCD1=0",
            "OCD1=1"
          ],
          "description": "Overcurrent in Discharge 1 Safety Fault"
        },
        {
          "range": [
            3,
            3
          ],
          "mode": "enum",
          "names": [
            "OCD2=0",
            "OCD2=1"
          ],
          "description": "Overcurrent in Discharge 2 Safety Fault"
        },
        {
          "range": [
            2,
            2
          ],
          "mode": "enum",
          "names": [
            "OCC=0",
            "OCC=1"
          ],
          "description": "Overcurrent in Charge Safety Fault"
        },
        {
          "range": [